Israel's blockade of Gaza is a direct consequence of attacks launched from within the territory	pos
The blockade is deemed illegal	neg
Humanity cannot continue allowing a city to be slowly strangled	neg
tragedies are completely inevitable if Israel does not listen to the callings of the international community to end the unacceptable and counter-productive blockade of Gaza	neg
tragedies are entirely avoidable if Israel heeds the repeated calls of the international community to end its counterproductive and unacceptable blockade of Gaza	neg
Peace and stability will not come to the region as long as the blockade of Gaza persists	neg
Israeli blockade in Gaza is a violation of international law	neg
The blockade action is a violation of international law	neg
Israel has a right to stop weapons from going into Gaza	pos
Israel is entirely within its rights to prevent Hamas from linking with groups suspected of supplying arms and money to terrorists	pos
Holocaust denial is generally viewed as antisemitic	neg
The primary motivation for most deniers is anti-Semitism	neg
Holocaust denial can inspire violence against Jews	neg
Jews' rights are best protected in open and tolerant democracies that actively prosecute all forms of racial and religious hatred	pos
the work of Holocaust deniers should be protected by a universal right to free speech	pos
laws punishing Holocaust denial are incompatible with the European Convention on Human Rights and the Universal Declaration of Human Rights	neg
education is more effective than legislation at combating Holocaust denial	neg
the laws will make martyrs out of those imprisoned for their violation	neg
Courts consider Holocaust denial a form of spreading hatred and therefore an offence	neg
Holocaust denial is described as an affront to our humanity	neg
It is incorrect to force only one view	neg
Holocaust denial propaganda in all forms has shown to influence the audiences that it reaches	neg
Holocaust denial is a convenient polemical substitute for anti-semitism	neg
"denial legislation imposes ""historical truth as legal truth"	neg
Holocaust denial is the worst form of racism	neg
Denial is among the surest indicators of further genocidal massacres	neg
The denial of such an unimaginable murder of millions cannot simply be accepted as something protected by the freedom of speech	neg
free speech should be applied to everyone regardless of their viewpoints	pos
it is a slippery slope to imprison someone due to the lack of factual accuracy or unpopularity of their opinions	neg
Holocaust denial law restricts the freedom of expression, which is a basic human right	neg
denying or minimising the Holocaust must be seen as one of the acutest forms of racial slandering	neg
Open-source-appropriate technology built in continuous peer-review can result in better quality	pos
"The ""open-source"" model can act as a driver of sustainable development"	pos
Innovations have come, and continue to come, from the open-source world	pos
users should be able to study and change the software they use	pos
"proprietary software commonly contains ""malicious features"	neg
the widely available code for open-source software makes it easier to identify security vulnerabilities	pos
wide availability results in increased scrutiny of the source code, making open source software more secure	pos
proprietary software may include defects or malicious features which would compromise sensitive information	neg
A dependency on the future versions and upgrades for a proprietary software package can create vendor lock-in, entrenching a monopoly position	neg
Free software can result in permanently lower costs compared to proprietary software	pos
With free software, businesses can fit software to their specific needs by changing the software	pos
Free software often has no warranty	neg
FOSS provides high code visibility and the ability to fix security flaws quickly and quietly	pos
The autonomy properties of FOSS make it useful	pos
FOSS cannot be used with other types of software	neg
FOSS applications tend to be much lower in cost than their proprietary equivalents	pos
FOSS applications often provide high levels of functionality with good user acceptance	pos
Open source software promotes learning and understanding	pos
proprietary software is unethical and unjust	neg
The collaborative nature of the open source community creates software that can offer customizability	pos
The open source community promotes the creation of software that is not proprietary, thus resulting in lower costs	pos
Open source provides a flexibility not available in closed products	pos
A major advantage to open source code is the ability for a variety of different people to edit and fix problems and errors that have occurred	pos
open source software promotes better programs and a higher standard of code	pos
software produced in this fashion may lack standardization and be incompatible with various computer applications	neg
Not much support exists for open source software	neg
Open source software will often be less usable	neg
The open source software allows anyone to make changes that will improve it	pos
Open source software can increase speed and flexibility	pos
lesser dependence on proprietary software allows for easier integration of various systems	pos
adoption of open-source software models has resulted in savings	pos
Having more co-developers increases the rate at which the software evolves	pos
open-source software provides solutions to unique or specific problems	pos
One of the greatest barriers facing wide acceptance of open-source software relates to the lack of technical and general support	neg
open-source software is inherently safer	pos
less costs of marketing and logistical services are needed for OSS	pos
The OSS development approach has helped produce reliable, high quality software	pos
Open source software offers the potential for a more flexible technology and quicker innovation	pos
Open source software is said to be more reliable	pos
Open source software is flexible	pos
Open source software is innovative	pos
OSS does not require thinking about commercial pressure that often degrades the quality of the software	pos
open source may allow hackers to know about the weaknesses or loopholes of the software more easily than closed-source software	neg
open source software increases software security	pos
Proprietary software forces the user to accept the level of security that the software vendor is willing to deliver	neg
"The end-user of Open Source code has the ability to change and modify source to implement any extra ""features"" of security they may wish for a specific use"	pos
All people have access to the source code, including potential attackers	neg
"Having a large amount of eyes reviewing code can ""lull a user into a false sense of security"	neg
Tuition fees at private universities tend to be higher than at public universities	neg
Public universities often have much lower tuition than private universities	pos
private universities charge much higher tuition than their public counterparts	neg
privatization consistently improves efficiency	pos
corruption is more prevalent in non-privatized sectors	neg
private market factors can more efficiently deliver many goods or service than governments	pos
governments have few incentives to ensure that the enterprises they own are well run	neg
A state-monopolized function is prone to corruption	neg
Nationalized industries are prone to interference from politicians for political or populist reasons	neg
certain public goods and services should remain primarily in the hands of government in order to ensure that everyone in society has access to them	pos
private entities are more efficiently run	pos
Academics are demoralized by government interference with admissions procedures	neg
all over the world there are excellent universities run independently of the state	pos
It is dangerous to have a university funded by private equity	neg
"if universities are ""to nurture genuinely free and creative academic research"" and ""be the guardians of liberty which a free society needs"" they must be independent of government funding"	pos
academics will only be able to challenge prevailing opinion if they are independent of government funding	pos
Dependence on government funding has had disastrous effects on the higher education sector in continental Europe	neg
ASEAN members have the potential to reap significant benefits	pos
Aside from improving each member state's economies, the bloc also focuses on peace and stability in the region	pos
ASEAN has subscribed to the notion of democratic peace	pos
Through political dialogue and confidence building, no tension has escalated into armed confrontation among ASEAN member countries	pos
ASEAN Way has recently proven itself relatively successful in the settlements of disputes by peaceful manner	pos
ASEAN is criticised for being too soft in its approach to promoting human rights and democracy	neg
"the organisation is ""big on words but small on action"	neg
ASEAN has begun to be less successful at restraining its members and resolving border disputes	neg
the agenda of economic integration would negatively affect industries	neg
The organisation is viewed as imperialistic	neg
Abstinence is the only way to avoid sexually transmitted diseases	pos
education on condom use reduces behaviors that increase the risk of breakage and slippage	pos
no studies have shown abstinence-only programs to result in delayed intercourse	neg
parents want their children to receive comprehensive sexuality education including condom use	pos
condom-promotion programs encourage promiscuity	neg
educating children about sex can encourage them to engage in it	neg
"The majority of parents reject the so-called ""comprehensive"" sex education approach"	neg
"the importance of the ""wait to have sex"" message ends up being lost when programs demonstrate and encourage the use of contraception"	neg
sexual behavior after puberty is a given, and it is therefore crucial to provide information about the risks and how they can be minimized	pos
abstinence-only sex ed and conservative moralizing will only alienate students	neg
Adolescents who begin having sexual intercourse need to understand the importance of using an effective contraceptive every time they have sex	pos
the comprehensive programs work for youth population across the spectrum	pos
Premarital sex is considered to be morally objectionable	neg
teaching of contraception for school children presume premarital sex from the outset and somewhat imply that such things are morally permissible	neg
Comprehensive curricula fail to teach moral behavior	neg
sex education programs focusing on both abstinence and contraception had a positive effect on teen sexual behavior	pos
Programs that stress abstinence as the only acceptable behavior for unmarried teens delay the initiation of sex	pos
there does not exist strong evidence that any particular abstinence program is effective at delaying sex or reducing sexual behavior	neg
studies of abstinence programs have not produced sufficient evidence to justify their widespread dissemination	neg
"a morality based on sex only within the bounds of marriage is ""healthy and constructive"	pos
Abstinence is the most effective preventative measure against both pregnancy and sexually transmitted diseases	pos
sexual activity outside of the context of marriage is likely to have harmful psychological and physical effects	neg
Denying teens factual information leads to unwanted pregnancies and STIs	neg
abstinence-only programs deprive teenagers of critical information about sexuality	neg
sex education needs to be comprehensive to be effective	pos
Abstinence-only programs have not demonstrated successful outcomes	neg
"abstinence-only sex education programs ""reduce risky sexual behaviours"	pos
Sex education programs focusing on both abstinence and contraception have a positive effect on teen sexual behavior	pos
Abstinence-only programs delay the initiation of sex	pos
abstinence-only sex education leads to the opposite of the intended results by spreading ignorance regarding sexually transmitted diseases and the proper use of contraceptives	neg
Abstinence only sex education does not decrease rates of unplanned pregnancy	neg
abstinence-only education is ineffective	neg
abstinence-only education is motivated by religious teachings, which have no place in the classroom	neg
sex before marriage and at a young age has heavy physical and emotional costs	neg
such programs fail to provide adequate information to protect the health of adolescents	neg
such programs verge on religious interference in secular education	neg
abstinence-only sex education distorts information about contraceptives	neg
Evidence has not supported the effective use of abstinence-only sex education	neg
Abstinence-only sex education does not decrease rates of unplanned pregnancy	neg
abstinence-only-until-marriage programs are ineffective	neg
early sexual activity - whether in or out of a romantic relationship - does far more harm than good	neg
Comprehensive sex education covers abstinence as a positive choice, but also teaches about contraception and avoidance of STIs	pos
all abstinence programs are ineffective	neg
abstinence only sex education is ineffective	neg
Abstinence until marriage is the most effective way to avoid HIV infection	pos
abstinence is the only guaranteed way of avoiding unwanted pregnancies and contraction of STDs	pos
The lack of education on safe sex, whether it’s from parents, schools, or otherwise, is a cause of teenage pregnancy	neg
comprehensive sex education would effectively reduce the number of teenage pregnancies	pos
Comprehensive sex education encourages more and earlier sexual activity	neg
Evidence does not support the use of abstinence only sex education	neg
Providing safe-sex education promotes promiscuity	neg
Abstinence-only programs have no positive effects	neg
sex education is necessary to prepare the young for the task ahead	pos
Countries with conservative attitudes towards sex education have a higher incidence of STIs and teenage pregnancy	neg
broad sex education programs have global benefits	pos
Sex education in school makes it easier for parents to talk to their adolescents about sex	pos
Adolescents want both to talk to their parents about sex and to have comprehensive in-school sex education	pos
abstinence-only programs did not reduce the likelihood of pregnancy	neg
the vast majority of Americans favor broader sex education programs over those that teach only abstinence	pos
open dialogue about physical intimacy and health education can generate more self-esteem	pos
sexual behavior outside of marriage is immoral	neg
Abstinence is 100% effective in preventing pregnancy	pos
Abstinence-only education programs often provide inaccurate information about contraceptives and sexuality	neg
Abstinence-only education will result in decreased rates of teenage pregnancy and STD infection	pos
Abstinence-only sex education programs show an increase in the rates of pregnancy and STDs of a teenage population	neg
Professional medical organizations oppose the sole use of abstinence-only sex education	neg
sexual abstinence confers numerous health benefits	pos
Sexual abstinence diminishes the risk of contracting sexually transmitted diseases	pos
sexual abstinence in teenagers decreases the risk of contracting STDs and having children outside marriage	pos
excessive repression of the sexual instinct leads to an increase in the overall level of aggression in a given society	neg
Education programs which focus exclusively on abstinence have never been shown to delay sexual activity	neg
Sex-abstinence programs do not stop risky sexual behavior, or help in the prevention of unwanted pregnancy	neg
term limits are a way to restore popular control over government	pos
The longer politicians are in office, the more likely they are to rip us off for their own benefit	neg
"term limits force politicians ""to represent the people instead of advancing their own careers"	pos
"voters ""overwhelmingly support term limits"	pos
Term limits refresh the political system, removing legislators who had become career politicians and grown out of touch with their constituents	pos
Term limits reduce the excessive time and attention spent on getting re-elected	pos
Incumbents have too great an electoral advantage	neg
Lawmakers are in gridlock because of becoming locked into entrenched positions over time	neg
Freed from political considerations related to re-election, lawmakers would be more free to vote on the merits	pos
Term limits don't distinguish between good and bad legislators	neg
New lawmakers are more vulnerable to power wielded by lobbyists	neg
Term limits won't affect gridlock, being a quick-fix that ignores complicated problems	neg
Limiting terms deprives voters of the right to choose whom they want in office	neg
The lack of mandatory limits to tenure is regarded as a dangerous defect	neg
contact with the affairs of state is one of the most corrupting of the influences to which men are exposed	neg
The States' have the authority to promulgate flag desecration laws under their general police power to safeguard public safety and welfare	pos
symbolic speech is protected by the First Amendment	pos
Flag burning is protected by the First Amendment	pos
protest involving the physical use of the flag should be seen as a form of protected expression under the First Amendment	pos
Burning the flag is a form of symbolic speech subject to protection under the First Amendment	pos
Symbolic speech is recognized as being protected under the First Amendment as a form of speech	pos
there is a constitutional right to make one's speech as effective as possible	pos
Flag burning is a form of free speech	pos
freedom of expression by non-speech means is commonly thought to be protected under the First Amendment	pos
burning the flag is a very offensive gesture that deserves to be formally outlawed	neg
Americans oppose amending the constitution to outlaw flag burning	neg
Americans oppose a flag desecration amendment	neg
Americans support a flag desecration amendment	pos
Flag burning is constitutionally-protected free speech	pos
Flag burning is protected speech under the First Amendment to the United States Constitution	pos
the First Amendment protects such activity as symbolic speech	pos
The First Amendment reaches non-speech acts	pos
States have a compelling interest in preserving a venerated national symbol	pos
Flag burning tends to incite breaches of the peace	neg
States possess an interest in preserving the flag as a unique symbol of national identity and principles	pos
Desecration of the flag impugns its value as such a unique national symbol	neg
"the ""uniqueness"" of the flag ""justifies a governmental prohibition against flag burning"	pos
"flag burning is ""no essential part of any exposition of ideas"	neg
Flag burning is most likely to be indulged in not to express any particular idea, but to antagonize others	neg
the First Amendment does not guarantee the right to employ every conceivable method of communication at all times and in all places	neg
A majority of Americans support a ban on flag-burning	pos
the Constitution allows states to prohibit the burning of the flag	pos
laws against flag-burning are constitutional	pos
flag-burning is not constitutionally protected	neg
it would be constitutional to ban flag-burning	pos
The flag's status as a special emblem of nationality entitles it to additional protections	pos
the state can prohibit the burning of any item in public	pos
Individuals interested in college football prefer a playoff system to the BCS	pos
Often, the BCS system leads to controversies	neg
Controversies concerning inclusion in the BCS National Championship Game are numerous	neg
Significant support among college football fans for a playoff to replace the BCS is shown	pos
the participants of the BCS National Championship game are decided based upon coaches' and media polls rather than via previous, on-field competition	neg
a playoff format would detract from the importance of the regular season and the intensity of rivalry games	neg
a playoff system would create conflicts with student-athletes' studies	neg
a single loss can potentially end a team's chance at a National Championship or propel some other team into the title game under the current system	neg
Unfair competition is inherent in the structure of the BCS	neg
numerous FBS Conferences have expressed their unwillingness to participate in a play-off system	neg
due to the unique and often esoteric nature of the BCS format, there has been controversy as to which two teams should play for the national championship	neg
Implementation of a playoff system would lead to other, more serious consequences	neg
a team with similar or better arguments to another team can be left out of the BCS despite beating the other team	neg
there are several key advantages that the BCS has over a playoff system	pos
the BCS routinely involves controversy about which two teams are the best in the nation	neg
Markets are regulated to some extent by government in order to correct market failures or to promote social welfare	pos
intervention is necessary to solve market-created externalities	pos
government should intervene to prevent market failure	pos
people should make their own choices with their money	pos
the state often serves dominant business interests, distorting the market to their favor and thus leading to inefficient outcomes	neg
Social inequalities result from free-market outcomes	neg
if everyone is left to their own economic devices instead of being controlled by the state, then the result would be a harmonious and more equal society	pos
Allowing individuals to act without any restrictions will produce the best results	pos
the state has a legitimate role in providing public goods	pos
the free market can damage national traditions	neg
Government intervention is seen as harmful	neg
Financial liberalization and privatization coincide with democratization	pos
private market factors can more efficiently deliver many goods or service than governments due to free market competition	pos
A private company will serve the needs of those who are most willing (and able) to pay, as opposed to the needs of the majority	neg
wages are naturally driven down in free market systems	neg
there is an inherent tendency toward oligolopolistic structures when laissez-faire is combined with capitalist private property	neg
the allocation of goods and services by a market is not efficient	neg
the lack of perfect information and perfect competition in a free market is grounds for government intervention	pos
free markets usually fail to deal with the problem of externalities	neg
the free market is not necessarily free, but weighted towards those who already own property	neg
corrective measures) reduce the overall efficiency of the market economy	neg
corrective policies limit the incentive system of the market	neg
grave imbalances are produced when economic action, conceived merely as an engine for wealth creation, is detached from political action	neg
The freer the market, the more prices will reflect consumer habits and demands	pos
Through free competition between vendors for the provision of products and services, prices tend to decrease, and quality tends to increase	pos
"market economies allow spontaneous order; that is, ""a more efficient allocation of societal resources than any design could achieve"	pos
any attempt to implement central planning will result in more disorder, or a less efficient production and distribution of goods and services	neg
there is a direct relationship between economic growth and economic freedom	pos
government at times has to intervene to ensure competition in large and important industries	pos
only a free market can create healthy competition and therefore more business	pos
The unregulated market is seen as an impractical ideal	neg
free market relationships are considered as structured upon coercion	neg
The free market is believed to self-regulate in the most efficient and just way	pos
virtually all developed countries today successfully promoted their national industries through protectionism	pos
there is a legitimate need for government restrictions on free trade	pos
laissez-faire capitalism creates social evils that harm its citizens	neg
the gains from free trade outweigh any losses	pos
the benefits of free trade outweigh the losses	pos
most of the world's major economies are resorting to protectionist measures as the global economic slowdown begins to bite	pos
by trying to maximize their own gains in a free market, individual ambition benefits society	pos
it is competition between buyers and sellers that channels the profit motive of individuals on both sides of the transaction such that improved products are produced and at lower costs	pos
individual self-interest operating in a competitive market place produces the unique conditions under which a society’s total utility is maximized	pos
free markets, by themselves, often do not lead to what is best	neg
some regulation is required to make markets work	pos
competitive markets do a good job allocating resources	pos
free trade will make society more prosperous	pos
free trade increases the global level of output	pos
the absolute quantity of goods and services produced is highest under free trade	pos
Laissez-faire economic politics and parties permit faster growth	pos
the world can produce and consume more when free trade is allowed	pos
free trade encourages economic interdependence between countries, reducing the likelihood of war	pos
free trade would reduce war	pos
the occurrence of free trade has prevented the outbreak of war	pos
free trade would increase the likelihood of a lasting peace	pos
Free trade can enhance national security	pos
free trade gives optimal economic advantages	pos
